{
  "task_id": "T009",
  "outcome": "CANDIDATE_READY",
  "summary": "Implemented the deterministic offline acceptance-criteria checker introduced by T009. The checker parses every todo/phases/**/T[0-9]{3}.md with the Python standard library and fails closed on three rule families: acceptance-present (missing/empty Acceptance section or one with no falsifiable condition: no verification surface, no explicit pass/fail, and no rejection/refusal/invalid-input condition), acceptance-placeholder (a closed placeholder marker in Acceptance: TBD, TODO, to be determined, as appropriate, if possible), and acceptance-quantitative (a comparison phrase from the closed vocabulary that appears in Deliverables but never in Acceptance; the two grounded examples are the 5-minute USDG return <= -80% and the 5-minute return above 100%). The closed vocabulary (verification surfaces, explicit outcome terms, placeholder markers, comparison operators, unit terms) is committed beside the check and printed with every finding so a reviewer can re-derive every match by hand. The exception list is the same docs/implement/ci/suppressions.toml file T005 and T006 already share; T009 scopes its suppression-unused check to its own rule family names so T005/T006 entries never leak across checkers. Five pre-existing findings against contracts T000, T023, T092, and T009 (self-reference for the two historical cases) are recorded as suppressions with the required rule/reason/owner/expiry fields and a 2026-12-31 expiry. The check is wired into .github/workflows/ci.yml as a strictly additive required check between the T006 step and the ruff/mypy gates. The committed repository passes the check; exit code 0 on a passing repo, exit code 1 when any of the regression fixtures is run.",
  "commands": [
    {
      "command": "/home/lpdev/miniconda3/envs/robinhood-lp/bin/python -m tools.check_acceptance check --repo-root .",
      "result": "Declared closed vocabulary: verification surfaces [...], explicit outcome terms [...], placeholder markers [TBD, TODO, to be determined, as appropriate, if possible], comparison operators [...], unit terms [...]. acceptance check passed: no findings (exit 0)."
    },
    {
      "command": "/home/lpdev/miniconda3/envs/robinhood-lp/bin/python -m pytest tests/test_acceptance.py -v",
      "result": "25 passed in 0.12s. Covers: test_check_passes_on_clean_contract; test_acceptance_present_seeded_regression; test_acceptance_empty_seeded_regression; test_acceptance_placeholder_seeded_regression; test_acceptance_quantitative_seeded_regression (with the two historical cases <= -80% and above 100% as grounded fixtures); test_acceptance_quantitative_passes_when_acceptance_covers_rule; test_missing_contract_set_fails_closed; test_empty_contract_set_fails_closed; test_unreadable_suppression_entry_fails_closed; test_stale_suppression_is_fatal; test_unused_placeholder_marker_is_a_finding; test_acceptance_present_records_section_and_line; test_acceptance_quantitative_records_matched_text; test_contract_set_covers_required_roots; test_check_passes_on_real_repository; test_finding_dataclass_supports_set_membership; test_format_findings_prints_vocabulary; test_format_findings_handles_empty; test_vocabulary_lists_match_contract; test_comparison_phrase_extraction[<=-80%]; test_comparison_phrase_extraction[above 100%]; test_comparison_phrase_extraction[at least 5 minutes]; test_comparison_phrase_extraction[exceeds 80 percent]; test_comparison_phrase_extraction[more than 100 USDG]; test_comparison_phrase_extraction[below 50 ms]."
    },
    {
      "command": "/home/lpdev/miniconda3/envs/robinhood-lp/bin/python -m pytest",
      "result": "2054 passed, 6 skipped, 2 failed. The 2 failures are pre-existing and unrelated to T009: tests/test_abi_artifacts.py::test_artifact_byte_matches_regenerated_oracle_output fails because Foundry's vendored Solidity sources under tools/oracle/lib/ are absent in this worktree (environment issue); tests/test_documentation_citations.py::test_check_passes_on_real_repository fails because the T005 citation check has a pre-existing member-access finding on docs/implement/DOCUMENTATION_INTEGRITY_AUDIT.md:242 (storage.schema) that the T005 owner has not yet suppressed. Both failures exist on the base commit (3946c46) and are not caused by any T009 change."
    },
    {
      "command": "/home/lpdev/miniconda3/envs/robinhood-lp/bin/python -m ruff format --check tools/check_acceptance/ tests/test_acceptance.py",
      "result": "8 files already formatted."
    },
    {
      "command": "/home/lpdev/miniconda3/envs/robinhood-lp/bin/python -m ruff check tools/check_acceptance/ tests/test_acceptance.py",
      "result": "All checks passed!"
    },
    {
      "command": "/home/lpdev/miniconda3/envs/robinhood-lp/bin/python -m mypy --strict tools/check_acceptance/ tests/test_acceptance.py",
      "result": "Success: no issues found in 8 source files."
    },
    {
      "command": "/home/lpdev/miniconda3/envs/robinhood-lp/bin/python -m pytest tests/test_documentation_links.py",
      "result": "2 passed (existing can-it-fail regression plus the link-resolution check). T009 does not modify either test."
    },
    {
      "command": "/home/lpdev/miniconda3/envs/robinhood-lp/bin/python -m ruff format --check . && /home/lpdev/miniconda3/envs/robinhood-lp/bin/python -m ruff check .",
      "result": "415 files already formatted; All checks passed! (repo-wide)."
    }
  ],
  "residual_risks": [
    "Two pre-existing test failures unrelated to T009 remain on this worktree: test_abi_artifacts.py::test_artifact_byte_matches_regenerated_oracle_output (Foundry vendored sources absent) and test_documentation_citations.py::test_check_passes_on_real_repository (a stale T005 citation finding on docs/implement/DOCUMENTATION_INTEGRITY_AUDIT.md:242 about storage.schema). T009 is not the contract owner for either and does not edit the surfaces they touch.",
    "The four pre-existing acceptance-present findings against T000, T023, T092 and the two acceptance-quantitative findings against T009 (its own Deliverables quoting the two historical cases) are suppressed with a 2026-12-31 expiry. A reviewer who wants those contracts to pass the bare check without the suppression must amend the contract text; the T009 contract explicitly forbids editing the other contracts to silence findings, so the suppression carries the obligation forward.",
    "The closed vocabulary is wider than the minimal five phrases each rule list could carry (e.g. tests/test_, test_, tests, test, test, tested, and the word 'command' are all accepted as verification surfaces). Widening is permitted by the contract; the reviewer can inspect tools/check_acceptance/vocabulary.py to confirm no entry was added to mask a contract already in the repo. The vocabulary cannot be narrowed, emptied or shortened to make a finding pass.",
    "mypy on src tests reports a pre-existing error about tests/_storage_t031_fixtures.py being found twice under different module names; this is a fixture-file naming issue inherited from the baseline and is not introduced or addressed by T009. The CI step uses mypy src tests exactly as the baseline did; nothing T009-related fails there."
  ]
}
